{
  "$schema": "https://json-schema.org/draft/2020-12/schema",
  "$id": "https://apex.local/schemas/site-contract.schema.json",
  "type": "object",
  "required": ["schemaVersion", "version", "hash", "product", "shell", "tokens", "typography", "spacing", "components", "icons", "tables", "charts", "motion", "responsive", "pageFamilies", "protectedFunctions"],
  "properties": {
    "schemaVersion": { "const": "3.0" },
    "version": { "type": "string", "minLength": 1 },
    "hash": { "type": "string", "minLength": 1 },
    "product": { "type": "object" },
    "shell": { "type": "object" },
    "tokens": { "type": "object" },
    "typography": { "type": "object" },
    "spacing": { "type": "object" },
    "components": { "type": "object" },
    "icons": { "type": "object" },
    "tables": { "type": "object" },
    "charts": { "type": "object" },
    "motion": { "type": "object" },
    "responsive": { "type": "object" },
    "pageFamilies": { "type": "object" },
    "protectedFunctions": { "type": "array" },
    "overrides": { "type": "array" }
  }
}
